{
  "schema_version": "0.1.0",
  "estimate_kind": "pjp_service_weekday",
  "created_at": "2026-10-09T08:00:00+00:00",
  "model_provenance": {
    "ir_content_hash": "3f9a1c7e5b2d4a8f0c6e1d3b5a7f9e2c4d6b8a0f2e4c6d8b0a2f4e6c8d1b3a5f",
    "evidence_id": "ev-9c4f2a8e6d1b"
  },
  "units": [
    {
      "unit_id": "S-A",
      "value": 10.8,
      "sigma": 0.127475,
      "quantized": {
        "rule": "p80_weekday_coverage",
        "weekdays": [
          1,
          3
        ],
        "quantile": 0.8
      }
    },
    {
      "unit_id": "S-B",
      "value": 8.52,
      "sigma": 0.06,
      "quantized": {
        "rule": "p80_weekday_coverage",
        "weekdays": [
          2
        ],
        "quantile": 0.8
      }
    },
    {
      "unit_id": "S-C",
      "value": 10.11,
      "sigma": 0.04,
      "quantized": {
        "rule": "p80_weekday_coverage",
        "weekdays": [
          1
        ],
        "quantile": 0.8
      }
    }
  ],
  "quantization_rule": "p80_weekday_coverage",
  "value_unit": "units_per_day",
  "envelope_id": "env-8d3eab2c77cf",
  "content_hash": "8d3eab2c77cff8de955e274eb49da05f9bf49dde13e950333e956f0bdad2c894"
}
