{
  "schema_version": "0.1.0",
  "estimate_kind": "warehouse_demand",
  "created_at": "2026-10-09T08:00:00+00:00",
  "model_provenance": {
    "ir_content_hash": "3f9a1c7e5b2d4a8f0c6e1d3b5a7f9e2c4d6b8a0f2e4c6d8b0a2f4e6c8d1b3a5f",
    "evidence_id": "ev-9c4f2a8e6d1b"
  },
  "units": [
    {
      "unit_id": "SKU-EAST-01",
      "value": 121.2,
      "sigma": 0.0
    },
    {
      "unit_id": "SKU-EAST-02",
      "value": 86.355,
      "sigma": 0.0
    },
    {
      "unit_id": "SKU-WEST-01",
      "value": 40.653,
      "sigma": 0.0
    }
  ],
  "quantization_rule": null,
  "value_unit": "units_per_day",
  "envelope_id": "env-5d60d1a37935",
  "content_hash": "5d60d1a37935dc906feeb0132746f5b413a9be61583306caf147387dade51f7b"
}
